Code,College Name,Type,SM,EW,EZ,MU,BH,LA,DV,VK,BX,KU,KN,SC,ST,Course,Year
JEC,"Jyothi Engineering College, Cheruthuruthy.",S,24150,0,28773,37553,0,0,0,31029,0,0,0,0,0,Electronics & Communication Engineering,2022
JIT,"John Cox Memorial CSI Institute of Technology,",S,57563,0,0,0,0,0,0,0,0,0,0,0,0,Electronics & Communication Engineering,2022
KIT,"Kottayam Institute of Tech. & Science, Pallicathode,",S,55087,0,0,0,0,0,0,0,0,0,0,0,0,Electronics & Communication Engineering,2022
KMC,"KMCT College of Engineering, Kozhikkode.",S,47424,0,52348,49644,51051,0,0,0,0,0,0,0,0,Electronics & Communication Engineering,2022
KME,"K M E A Engineering College, Edathala.",S,40089,0,0,0,0,0,0,42936,0,0,0,0,0,Electronics & Communication Engineering,2022
LMC,"Lourdes Matha College of Science and Technology,",S,48237,0,0,0,58573,0,0,0,0,0,0,0,0,Electronics & Communication Engineering,2022
MBC,"Mar Baselios Christian College of Engg. & Tech., Peermede.",S,52062,0,53155,0,0,0,0,0,0,0,0,0,0,Electronics & Communication Engineering,2022
MBI,"Mar Baselios Institute of Technology & Science,",S,24325,0,24609,30592,34162,0,0,0,0,0,0,0,0,Electronics & Communication Engineering,2022
MBT,"Mar Baselious College of Engg. & Tech.,",S,17649,0,23548,19785,19787,35070,58402,24937,0,0,0,57429,0,Electronics & Communication Engineering,2022
MCC,"Musaliar College of Engineering, Chirayinkeezh.",S,50667,0,0,0,0,0,0,0,0,0,0,0,0,Electronics & Communication Engineering,2022
MCE,"Marian Engineering College, Kazhakuttom.",S,27495,0,30435,37629,0,0,0,41894,0,0,0,60029,0,Electronics & Communication Engineering,2022
MCK,"Musaliar College of Engineering & Tech., Pathanamthitta.",S,58894,0,0,0,0,0,0,0,0,0,0,0,0,Electronics & Communication Engineering,2022
MCT,"Mohandas College of Engg. & Tech., Nedumangad, TVM",S,50656,0,60037,0,58544,0,0,0,0,0,0,0,0,Electronics & Communication Engineering,2022
MEC,"Malabar College of Engineering & Tech., Wadakancherry.",S,60439,0,0,0,0,0,0,0,0,0,0,0,0,Electronics & Communication Engineering,2022
MEE,"MES College of Engineering & Technology, .Ernakulam.",S,50396,0,52501,50541,0,0,0,0,0,0,0,0,0,Electronics & Communication Engineering,2022
MEK,"MES Institute of Tech. & Management, Chathannoor.",S,49226,0,0,54173,0,0,0,0,0,0,0,56773,0,Electronics & Communication Engineering,2022
MES,"M E S College of Engineering, Kuttippuram.",S,23378,0,31207,25993,36973,0,0,0,0,0,0,0,0,Electronics & Communication Engineering,2022
MGC,"M G College of Engineering, Thiruvallom.",S,58691,0,0,0,0,0,0,0,0,0,0,0,0,Electronics & Communication Engineering,2022
MGE,"MGM College of Engineering & Technology, Ernakulam",S,57242,0,0,0,0,0,0,0,0,0,0,0,0,Electronics & Communication Engineering,2022
MGP,"Saintgits College of Engineering, Kottayam",S,14462,0,18274,18729,16441,20108,35824,21381,0,0,0,56624,0,Electronics & Communication Engineering,2022
MHP,"Ace College of Engineering, .Thiruvallam.",S,40611,0,55290,47518,0,0,0,0,55175,0,0,55421,0,Electronics & Communication Engineering,2022
MLM,"Mangalam College of Engineering, Ettumanoor.",S,46321,0,50879,53514,0,0,0,48426,0,0,0,0,0,Electronics & Communication Engineering,2022
MLT,"Malabar Institute of Technology, Anjarakandi.",S,58558,0,0,0,0,0,0,0,0,0,0,0,0,Electronics & Communication Engineering,2022
MUS,"Muslim Association College of Engineering, Venjaramoodu.",S,57994,0,0,0,0,0,0,0,0,0,0,0,0,Electronics & Communication Engineering,2022
MUT,"Muthoot Institute of Tech. & Science, Puthencurz,",S,9219,17146,15436,11264,14723,18035,0,0,0,28864,0,56486,0,Electronics & Communication Engineering,2022
MZC,"Mount Zion College of Engg., Pathanamthitta.",S,55976,0,0,0,0,0,0,0,0,0,0,0,0,Electronics & Communication Engineering,2022
NCE,"Nehru College of Engg. & Research Centre, Thiruvillwamala.",S,40232,0,50854,48983,40706,0,0,0,0,0,0,0,0,Electronics & Communication Engineering,2022
PAA,"P A Aziz College of Engineering, Karakulam,",S,42562,0,0,0,0,0,0,0,0,0,0,0,0,Electronics & Communication Engineering,2022
PRC,"Providence College of Engineering, Chengannur.",S,46583,59688,59790,0,0,0,0,0,0,0,0,0,0,Electronics & Communication Engineering,2022
RET,"Rajagiri School of Engineering and Technology, Kochi.",S,7151,0,9974,9842,7979,11721,14776,10245,21829,19511,33328,45819,0,Electronics & Communication Engineering,2022
RIE,"Rajadhani Institute of Engineering & Tech., Attingal.",S,39598,40507,41531,48814,41887,0,0,0,0,0,0,0,0,Electronics & Communication Engineering,2022
SBC,"Sree Buddha College of Engineering, Nooranadu.",S,36268,47827,39177,55016,0,0,0,0,0,0,0,0,0,Electronics & Communication Engineering,2022
SCM,"SCMS School of Engg. & Tech., Ernakulam",S,19613,29128,22584,27566,24324,26028,0,0,0,0,0,50041,0,Electronics & Communication Engineering,2022
SHM,"Shahul Hameed Memorial Engineering College, Kadakkal,",S,0,0,0,0,0,0,0,0,0,0,0,0,0,Electronics & Communication Engineering,2022
SHR,"Sahrdaya College of Engineering and Technology, Kodakara.",S,23874,0,24797,25714,30733,56036,0,0,0,0,0,48542,0,Electronics & Communication Engineering,2022
SIT,"Sarabhai Institute of Science & Technology, Vellanad.",S,56906,0,0,0,0,0,0,0,0,0,0,0,0,Electronics & Communication Engineering,2022
SJC,"St. Josephs College of Engineering and Technology,Palai.",S,19892,0,25246,22629,0,0,0,53093,34271,0,0,0,0,Electronics & Communication Engineering,2022
SNC,"Sree Narayana Guru College of Engg & Technology,",S,41140,0,43597,42114,0,0,0,0,0,0,0,0,0,Electronics & Communication Engineering,2022
SNG,"Sree Narayana Gurukulam College of Engineering,",S,37193,43270,40712,56741,42438,0,0,0,0,0,0,46402,0,Electronics & Communication Engineering,2022
SNM,"Sree Narayana Mangalam Inst. of Mgmt. & Tech.,",S,56427,0,0,0,0,0,0,0,0,0,0,0,0,Electronics & Communication Engineering,2022
SNP,"Sree Narayana Institute of Technology, Adoor",S,52351,0,0,0,0,0,0,0,0,0,0,0,0,Electronics & Communication Engineering,2022
SPT,"Sreepathy Institute of Management & Tech., Koottanad.",S,37766,58256,40024,51258,43376,0,0,0,0,0,0,0,0,Electronics & Communication Engineering,2022
STC,"St. Thomas College of Engg. & Technology, Chengannur.",S,49358,0,53688,0,59419,0,0,0,0,0,0,0,0,Electronics & Communication Engineering,2022
STI,"St. Thomas Institute of Science & Technology, Kattaikonam.",S,48165,0,56357,55365,52457,0,0,0,0,0,0,0,0,Electronics & Communication Engineering,2022
STM,"St. Thomas College of Engineering & Technology,  Kannur.",S,34358,0,37713,37153,0,0,0,39414,0,0,0,0,0,Electronics & Communication Engineering,2022
TCT,"Trinity College of Engg, Neruvamoodu,",S,46927,0,0,0,0,0,0,0,0,0,0,0,0,Electronics & Communication Engineering,2022
TOC,"Toc H Institute of Science & Tech., Ernakulam",S,19747,28673,24412,23090,30725,31358,0,0,0,0,0,0,0,Electronics & Communication Engineering,2022
UKP,"UKF College of Engineering & Tech., Parippally.",S,60170,0,0,0,0,0,0,0,0,0,0,0,0,Electronics & Communication Engineering,2022
UNT,"Universal Engineering College, Vallivattom, Thrissur.",S,57763,0,0,0,0,0,0,0,0,0,0,0,0,Electronics & Communication Engineering,2022
VAK,"Vidya Academy of Science & Technology, Kilimanoor.",S,42364,52157,49899,46331,0,0,0,0,0,0,0,55452,0,Electronics & Communication Engineering,2022
VAS,"Vidya Academy of Science & Technology, Thrissur.",S,24782,38015,27954,40248,27008,0,31853,28536,0,0,0,52584,0,Electronics & Communication Engineering,2022
VIT,"VISAT Engineering College, Piravam, EKM.",S,52121,0,55268,55449,0,56640,0,0,58915,60218,0,0,0,Electronics & Communication Engineering,2022
VJC,"Viswajyothi College of Engg. & Technology,Vazhakulam.",S,17218,0,23578,20075,0,0,0,26572,0,0,0,0,0,Electronics & Communication Engineering,2022
VKE,"Valia Koonambaikulathamma College of Engg. & tech.,",S,57302,0,0,0,0,0,0,0,0,0,0,0,0,Electronics & Communication Engineering,2022
VML,"Vimal Jyothi Engineering College, Chemperi.",S,27783,0,29412,46280,29429,0,0,0,0,0,0,0,0,Electronics & Communication Engineering,2022
VPE,"Mahaguru Institute of Technology, Mavelikkara, Alappuzha",S,48527,52008,0,0,0,0,0,0,0,0,0,0,0,Electronics & Communication Engineering,2022
VVT,"Veda Vyasa Institute of Technology, Ponnempadam,",S,0,0,0,0,0,0,0,0,0,0,0,0,0,Electronics & Communication Engineering,2022
YCE,"Younus College of Engg. & Technology, Vadakkevila, Kollam",S,52025,0,0,0,0,0,54508,0,0,0,0,0,0,Electronics & Communication Engineering,2022
IDK,"Engineering College, Idukki",G,5385,26106,13161,12540,23532,27421,31877,16856,23691,38897,44648,49731,51348,Electrical & Electronics Engineering,2022
KNR,"Govt. College of Engineering, Kannur.",G,6214,14922,9479,9359,9168,17634,27478,9251,22646,30988,0,41347,26939,Electrical & Electronics Engineering,2022
KTE,"Govt. Rajiv Gandhi Institute of Tech., Kottayam.",G,5800,10213,6896,7329,8462,13293,22787,8003,0,0,0,34708,47940,Electrical & Electronics Engineering,2022
MAC,"M A College of Engineering, Kothamangalam.",G,5989,0,6806,6916,9595,13344,21151,7354,11609,25277,0,37428,50480,Electrical & Electronics Engineering,2022
NSS,"N S S College of Engineering, Palakkad.",G,6235,11935,9017,9004,8038,15308,26504,8998,29638,31517,34625,38092,0,Electrical & Electronics Engineering,2022
PKD,"Govt. Engineering College, Sreekrishnapuram.",G,4766,14937,11624,11623,11046,22366,44186,11389,0,0,0,36840,0,Electrical & Electronics Engineering,2022
TCR,"Govt. Engineering College,Thrissur.",G,2217,3941,3074,2503,3690,10036,9655,3333,10351,22711,18500,26285,55663,Electrical & Electronics Engineering,2022
TKM,"T K M College of Engineering, Kollam.",G,3863,0,4211,4240,4719,8444,14235,5735,11012,25625,27210,30914,31986,Electrical & Electronics Engineering,2022
TRV,"Govt. Engineering College, Barton Hills, TVM",G,4722,9534,5763,5492,4790,6032,25122,5867,11075,48049,36850,27042,39124,Electrical & Electronics Engineering,2022
TVE,"College of Engineering,Thiruvananthapuram.",G,721,2757,1302,1022,976,1807,7038,1706,4251,22055,10293,12309,33582,Electrical & Electronics Engineering,2022
WYD,"Govt. Engineering College, Mananthavady.",G,0,30916,13342,12629,23385,40606,52791,15963,33388,0,0,51702,48033,Electrical & Electronics Engineering,2022
ADR,"College of Engineering, Adoor",N,24565,34583,28841,32285,33318,52314,0,45794,52476,0,0,49966,0,Electrical & Electronics Engineering,2022
CEA,"College of Engineering, Attingal, Thiruvananthapuram.",N,19374,59432,25531,26099,0,0,0,23720,0,0,0,58669,0,Electrical & Electronics Engineering,2022
CEC,"College of Engineering, Cherthala, Alappuzha.",N,24972,55177,30845,32751,37861,37277,0,0,0,0,0,57860,0,Electrical & Electronics Engineering,2022
CEM,"College of Engineering, Muttathara.",N,38231,50583,44902,52970,46039,51879,0,54874,56840,0,0,60273,0,Electrical & Electronics Engineering,2022
CHN,"College of Engineering, Chengannur, Alappuzha.",N,21391,31388,28688,25121,31400,39648,51217,31760,0,0,0,56006,0,Electrical & Electronics Engineering,2022
KGR,"College of Engineering, Kidangoor.",N,39268,40433,41186,46208,44398,57819,0,0,0,0,0,0,0,Electrical & Electronics Engineering,2022
KNP,"College of Engineering, Karunagappally.",N,33125,43951,34635,36928,0,0,0,35289,0,0,0,0,0,Electrical & Electronics Engineering,2022
KSD,"LBS College of Engineering, Kasaragod.",N,35957,0,38977,39773,39391,46440,0,0,0,0,0,55637,0,Electrical & Electronics Engineering,2022
MDL,"Model Engineering College, Thrikkakkara.",N,4535,12485,6345,6348,10226,6927,0,7331,59158,20977,0,33711,0,Electrical & Electronics Engineering,2022
MNR,"College of Engineering, Munnar.",N,45073,0,46323,53966,0,0,0,54257,0,0,0,50237,0,Electrical & Electronics Engineering,2022
PRN,College of Engineering Perumon.,N,23545,35198,27973,35461,42059,32315,0,28079,52085,0,0,58349,0,Electrical & Electronics Engineering,2022
PRP,"College of Engineering & Management, Punnapra.",N,38087,45871,44907,43690,48424,49981,49655,42256,0,46970,0,0,0,Electrical & Electronics Engineering,2022
PTA,"College of Engineering, Kallooppara.",N,39961,44794,44837,53009,49947,0,0,47683,0,0,0,59997,0,Electrical & Electronics Engineering,2022
TKR,"College of Engineering, Thrikarippur, Kasaragod.",N,37268,0,41176,49603,37912,0,0,41792,0,0,0,0,0,Electrical & Electronics Engineering,2022
TLY,"College of Engineering, Thalassery, Kannur.",N,31553,0,33479,39616,35556,0,0,31781,0,0,0,52652,48065,Electrical & Electronics Engineering,2022
UCC,"Calicut Unity. Institute of Engineering & Tech., Tenhipalam.",N,26328,48845,38270,30158,29989,44645,48333,26734,0,0,0,60465,0,Electrical & Electronics Engineering,2022
UCE,"University College of Engineering,Thodupuzha.",N,48544,0,50048,58429,53054,0,0,54399,51485,0,0,0,0,Electrical & Electronics Engineering,2022
VDA,"College of Engineering, Vadakara, Kozhikode.",N,37398,0,40538,43886,40061,0,0,41145,0,0,0,49499,0,Electrical & Electronics Engineering,2022
AAP,"AlAmeen College of Engineering, Pattambi.",S,35768,0,0,0,0,0,0,0,0,0,0,0,0,Electrical & Electronics Engineering,2022
AIK,"Albertian Institute of Science and Technology, Kalamassery.",S,37968,0,42104,43693,0,0,0,0,0,0,0,0,0,Electrical & Electronics Engineering,2022
AJC,"Amal Jyothi College of Engineering, Koovapally, Kanjirapally",S,29622,0,37512,40600,39900,0,0,0,0,0,0,0,0,Electrical & Electronics Engineering,2022
AME,"Rajadhani Institute of Science and Technology, Palakkad",S,60566,0,0,0,0,0,0,0,0,0,0,0,0,Electrical & Electronics Engineering,2022
ASI,"Adi Sankara Institute of Engg. & Tech., Kalady, Ernakulam.",S,33372,53870,41417,48190,0,49444,0,0,0,0,0,0,0,Electrical & Electronics Engineering,2022
ATP,"Ahalia School of Engineering & Technology, Pudussery,",S,55253,0,0,0,0,0,0,0,0,0,0,0,0,Electrical & Electronics Engineering,2022
AWH,"AWH Engineering College, Kozhikkode",S,57286,0,58375,59010,0,0,0,0,0,0,0,0,0,Electrical & Electronics Engineering,2022
AXE,"Layola Institute of Science and Technology,East Kodaly,",S,55646,0,0,0,0,0,0,0,0,0,0,0,0,Electrical & Electronics Engineering,2022
BJK,"Bishop Jerome Institute, Kollam.",S,52670,0,0,59377,0,59939,0,0,0,0,0,0,0,Electrical & Electronics Engineering,2022
BMC,"Baselios Mathew II College of Engg., Sasthamcotta, Kollam.",S,58711,0,0,0,0,0,0,0,0,0,0,0,0,Electrical & Electronics Engineering,2022
CCE,"Christ College of Engineering, Irinjalakuda.",S,19278,0,29565,21442,0,0,33919,44308,0,0,0,0,0,Electrical & Electronics Engineering,2022
CCV,"MGM College of Engineering and Pharmaceutical Sciences,",S,47376,0,0,0,0,0,0,0,0,0,0,0,0,Electrical & Electronics Engineering,2022
CEN,"College of Engineering and Technology, Payyannur, Kannur.",S,58413,0,0,0,0,0,0,0,0,0,0,0,0,Electrical & Electronics Engineering,2022
CMA,"Carmel College of Engg. & Technology, Punnapra,",S,59357,0,0,0,0,0,0,0,0,0,0,0,0,Electrical & Electronics Engineering,2022
DMC,"M Dasan Institute of Technology, Koyilandy.",S,48410,0,51582,57115,0,0,55824,0,0,0,0,0,0,Electrical & Electronics Engineering,2022
FIT,"Federal Institute of Science & Tech., Angamaly.",S,19253,28228,21838,21765,24554,36181,50459,0,0,0,0,0,0,Electrical & Electronics Engineering,2022
GIT,"Gurudeva Institute of Science & Technology, Puthuppally.",S,51955,0,0,0,0,0,0,0,0,0,0,0,0,Electrical & Electronics Engineering,2022
HCE,"Heera College of Engineering & Technology, Nedumangad.",S,55961,0,0,0,0,0,0,0,0,0,0,0,0,Electrical & Electronics Engineering,2022
HGW,"Holy Grace Academy of Engineering, Mala, Thrissur.",S,44070,0,0,0,0,0,0,0,0,0,0,0,0,Electrical & Electronics Engineering,2022
ICE,"Ilahia College of Engineering & Tech., Moovattupuzha.",S,51914,0,0,0,0,0,0,0,0,0,0,0,0,Electrical & Electronics Engineering,2022
IES,"I E S College of Engineering, Chittilappilly.",S,55319,0,0,0,0,0,0,0,0,0,0,0,0,Electrical & Electronics Engineering,2022
IGW,"Indira Gandhi Inst. of Engineering & Tech., Kothamangalam",S,36560,0,42494,45745,0,0,0,0,0,0,0,0,0,Electrical & Electronics Engineering,2022
JBT,"Jai Bharath College of Management & Engg. Tech.,",S,42374,0,0,0,0,0,0,0,0,0,0,0,0,Electrical & Electronics Engineering,2022
JEC,"Jyothi Engineering College, Cheruthuruthy.",S,32339,0,57034,38674,41628,0,0,0,0,0,0,0,0,Electrical & Electronics Engineering,2022
JIT,"John Cox Memorial CSI Institute of Technology,",S,59811,0,0,0,0,0,0,0,0,0,0,0,0,Electrical & Electronics Engineering,2022
KIT,"Kottayam Institute of Tech. & Science, Pallicathode,",S,0,0,0,0,0,0,0,0,0,0,0,0,0,Electrical & Electronics Engineering,2022
KMC,"KMCT College of  Engineering, Kozhikkode.",S,51370,0,54657,0,0,0,0,0,0,0,0,59747,0,Electrical & Electronics Engineering,2022
KME,"K M E A Engineering College, Edathala.",S,42407,0,0,44974,0,42693,0,0,0,0,0,0,0,Electrical & Electronics Engineering,2022
LMC,"Lourdes Matha College of Science and Technology,",S,59887,0,0,0,0,0,0,0,0,0,0,0,0,Electrical & Electronics Engineering,2022
MBC,"Mar Baselios Christian College of Engg. & Tech., Peermede.",S,51553,0,0,0,0,0,0,0,0,0,0,0,0,Electrical & Electronics Engineering,2022
MBI,"Mar Baselios Institute of Technology & Science,",S,41660,0,51918,0,0,0,0,0,0,0,0,0,0,Electrical & Electronics Engineering,2022
MBT,"Mar Baselious College of Engg. & Tech.,",S,20268,0,22642,38685,22349,41012,0,26323,0,0,0,0,0,Electrical & Electronics Engineering,2022
MCE,"Marian Engineering College, Kazhakuttom.",S,26651,0,39478,0,0,0,0,0,0,0,0,0,0,Electrical & Electronics Engineering,2022
MCK,"Musaliar College of Engineering & Tech., Pathanamthitta.",S,59807,0,0,0,0,0,0,0,0,0,0,0,0,Electrical & Electronics Engineering,2022
MCT,"Mohandas College of Engg. & Tech., Nedumangad, TVM",S,56664,0,0,0,0,0,0,0,0,0,0,0,0,Electrical & Electronics Engineering,2022
MEA,"M E A Engineering College, Malappuram.",S,39293,0,0,0,0,0,0,0,0,0,0,0,0,Electrical & Electronics Engineering,2022
MEK,"MES Institute of Tech. & Management, Chathannoor.",S,56010,0,0,0,0,0,0,0,0,0,0,0,0,Electrical & Electronics Engineering,2022
MES,"M E S College of Engineering, Kuttippuram.",S,38110,0,45711,41503,0,0,0,0,0,0,0,58395,0,Electrical & Electronics Engineering,2022
MGC,"M G College of Engineering, Thiruvallom.",S,58896,0,0,0,0,0,0,0,0,0,0,0,0,Electrical & Electronics Engineering,2022
MGE,"MGM College of Engineering & Technology, Ernakulam",S,58568,0,0,0,0,0,0,0,0,0,0,0,0,Electrical & Electronics Engineering,2022
MGP,"Saintgits College of Engineering, Kottayam",S,31769,0,37026,36601,41818,0,0,59680,0,0,0,0,54007,Electrical & Electronics Engineering,2022
MHP,"Ace College of Engineering, .Thiruvallam.",S,44065,0,55341,53432,53166,60518,0,0,0,0,0,0,0,Electrical & Electronics Engineering,2022
MLM,"Mangalam College of Engineering, Ettumanoor.",S,57270,0,0,0,0,0,0,0,0,0,0,0,0,Electrical & Electronics Engineering,2022
MUS,"Muslim Association College of Engineering, Venjaramoodu.",S,0,0,0,0,0,0,0,0,0,0,0,0,0,Electrical & Electronics Engineering,2022
MUT,"Muthoot Institute of Tech. & Science, Puthencurz,",S,17068,36468,23823,24166,21586,23217,47467,0,0,0,0,0,0,Electrical & Electronics Engineering,2022
NCE,"Nehru College of Engg. & Research Centre, Thiruvillwamala.",S,46939,0,49070,0,54191,0,0,0,0,0,0,0,0,Electrical & Electronics Engineering,2022
PAA,"P A Aziz College of Engineering, Karakulam,",S,0,0,0,0,0,0,0,0,0,0,0,0,0,Electrical & Electronics Engineering,2022
PRC,"Providence College of Engineering, Chengannur.",S,59846,0,0,0,0,0,0,0,0,0,0,0,0,Electrical & Electronics Engineering,2022
RET,"Rajagiri School of Engineering and Technology, Kochi.",S,11407,0,11969,16159,0,0,39272,15826,0,0,0,43464,0,Electrical & Electronics Engineering,2022
RIE,"Rajadhani Institute of Engineering & Tech., Attingal.",S,47046,0,57903,0,53483,0,0,0,0,0,0,0,0,Electrical & Electronics Engineering,2022
SBC,"Sree Buddha College of Engineering, Nooranadu.",S,49004,0,0,0,0,0,0,0,0,0,0,0,0,Electrical & Electronics Engineering,2022
SCM,"SCMS School of Engg. & Tech., Ernakulam",S,22746,0,25602,25823,0,0,0,39739,0,0,0,0,0,Electrical & Electronics Engineering,2022
SHM,"Shahul Hameed Memorial Engineering College, Kadakkal,",S,0,0,0,0,0,0,0,0,0,0,0,0,0,Electrical & Electronics Engineering,2022
SHR,"Sahrdaya College of Engineering and Technology, Kodakara.",S,31941,0,38482,45841,0,0,0,0,0,0,0,0,0,Electrical & Electronics Engineering,2022
SIT,"Sarabhai Institute of Science & Technology, Vellanad.",S,57562,0,0,0,0,0,0,0,0,0,0,0,0,Electrical & Electronics Engineering,2022
SJC,"St. Josephs College of Engineering and Technology,Palai.",S,38543,0,41607,0,53985,0,0,0,0,0,0,49578,0,Electrical & Electronics Engineering,2022
SNC,"Sree Narayana Guru College of Engg & Technology,",S,46720,0,54212,48630,0,0,0,0,0,0,0,0,0,Electrical & Electronics Engineering,2022
SNG,"Sree Narayana Gurukulam College of Engineering,",S,57995,0,0,0,0,0,0,0,0,0,0,0,0,Electrical & Electronics Engineering,2022
SNM,"Sree Narayana Mangalam Inst. of Mgmt. & Tech.,",S,56022,0,0,0,0,0,0,0,0,0,0,0,0,Electrical & Electronics Engineering,2022
SNP,"Sree Narayana Institute of Technology, Adoor",S,57387,0,0,0,0,0,0,0,0,0,0,0,0,Electrical & Electronics Engineering,2022
SNT,"Sree Narayana Guru Institute of Science & Tech., N.",S,59762,0,0,0,0,0,0,0,0,0,0,0,0,Electrical & Electronics Engineering,2022
SPT,"Sreepathy Institute of Management & Tech., Koottanad.",S,48362,0,0,0,0,0,0,0,0,0,0,0,0,Electrical & Electronics Engineering,2022
STC,"St. Thomas College of Engg. & Technology, Chengannur.",S,57331,0,0,0,0,0,0,0,0,0,0,0,0,Electrical & Electronics Engineering,2022
STI,"St. Thomas Institute of Science & Technology, Kattaikonam.",S,58158,0,0,0,0,0,0,0,0,0,0,0,0,Electrical & Electronics Engineering,2022
TCT,"Trinity College of Engg, Neruvamoodu,",S,52268,0,0,0,0,0,0,0,0,0,0,0,0,Electrical & Electronics Engineering,2022
TEC,"Travancore Engineering College, Oyoor, Kollam.",S,0,0,0,0,0,0,0,0,0,0,0,0,0,Electrical & Electronics Engineering,2022
TJE,"Thejus Engineering College, Erumapetti, Thrissur.",S,53997,0,0,0,0,0,0,0,0,0,0,0,0,Electrical & Electronics Engineering,2022
TKI,"T K M Institute of Technology, Ezhukone, Kollam.",S,39584,0,53858,56805,0,0,0,0,0,0,0,55513,0,Electrical & Electronics Engineering,2022
TOC,"Toc H Institute of Science & Tech., Ernakulam",S,39222,0,41541,47430,0,0,0,0,0,0,0,57206,0,Electrical & Electronics Engineering,2022
UKP,"UKF College of Engineering & Tech., Parippally.",S,52995,0,0,0,0,0,0,0,0,0,0,0,0,Electrical & Electronics Engineering,2022
UNT,"Universal Engineering College, Vallivattom, Thrissur.",S,58433,0,0,0,0,0,0,0,0,0,0,0,0,Electrical & Electronics Engineering,2022
VAS,"Vidya Academy of Science & Technology, Thrissur.",S,30240,38969,37123,47905,49897,0,0,0,0,0,0,45699,0,Electrical & Electronics Engineering,2022
VIT,"VISAT Engineering College, Piravam, EKM.",S,58163,0,0,0,0,0,0,0,0,0,0,0,0,Electrical & Electronics Engineering,2022
VJC,"Viswajyothi College of Engg. & Technology,Vazhakulam.",S,40450,0,55114,0,46359,55217,0,0,0,0,0,53192,0,Electrical & Electronics Engineering,2022
VKE,"Valia Koonambaikulathamma College of Engg. & tech.,",S,51413,0,0,0,0,0,0,0,0,0,0,0,0,Electrical & Electronics Engineering,2022
VML,"Vimal Jyothi Engineering College, Chemperi.",S,44075,0,50305,57812,0,0,51934,0,0,0,0,0,0,Electrical & Electronics Engineering,2022
VPE,"Mahaguru Institute of Technology, Mavelikkara, Alappuzha",S,48927,0,0,0,0,0,0,0,0,0,0,0,0,Electrical & Electronics Engineering,2022
VVT,"Veda Vyasa Institute of Technology, Ponnempadam,",S,0,0,0,0,0,0,0,0,0,0,0,0,0,Electrical & Electronics Engineering,2022
YCE,"Younus College of Engg. & Technology, Vadakkevila, Kollam",S,44610,0,0,0,0,0,0,0,0,0,0,0,0,Electrical & Electronics Engineering,2022
FIT,"Federal Institute of Science & Tech., Angamaly.",S,27573,44005,43190,43779,36536,0,0,0,0,0,0,0,0,Electronics & Instrumentation,2022
SIT,"Sarabhai Institute of Science & Technology, Vellanad.",S,56305,0,0,0,0,0,0,0,0,0,0,0,0,Electronics & Instrumentation,2022
TKM,"T K M College of Engineering, Kollam.",G,3248,0,4698,3630,3403,10658,20414,5336,0,0,15642,32662,0,Electrical and Computer Engineering,2022
KGR,"College of Engineering, Kidangoor.",N,33178,48517,35617,50588,50743,50451,0,0,0,0,0,60008,0,Electrical and Computer Engineering,2022
MBT,"Mar Baselious College of Engg. & Tech.,",S,24294,0,24424,44056,0,0,56663,37076,0,0,0,55967,0,Electrical and Computer Engineering,2022
MEA,"M E A Engineering College, Malappuram.",S,37289,0,46660,41550,53454,0,0,0,0,0,0,0,0,Electrical and Computer Engineering,2022
TOC,"Toc H Institute of Science & Tech., Ernakulam",S,37047,0,47934,41537,47710,53730,0,0,0,0,0,56420,0,Electrical and Computer Engineering,2022
LBT,"LBS Institute of Tech. for Women, Poojapura, TVPM",N,16628,29707,22053,20008,18097,18671,0,17840,0,0,0,50035,0,Electronics and Computer Engineering,2022
SJC,"St. Josephs College of Engineering and Technology,Palai.",S,28583,0,36376,49817,37456,53928,0,0,0,0,0,0,0,Electronics and Computer Engineering,2022
EKC,"Eranad Knowledgecity Technical Campus, Cherukulam,",S,57930,0,0,0,0,0,0,0,0,0,0,0,0,Safety & Fire Engineering,2022
TOC,"Toc H Institute of Science & Tech., Ernakulam",S,51980,53117,57925,0,0,0,0,0,0,0,0,59424,0,Safety & Fire Engineering,2022
CDT,"Verghese Kurien Institute of Dairy and Food Technology,",G,7904,13345,8239,9853,0,0,0,0,8682,58090,37773,36902,0,Food Technology,2022
COU,"School of Ocean Engg. & Underwater Tech., KUFOS,",G,11419,22689,13115,13614,13062,13311,17984,21546,23323,0,0,30679,39819,Food Technology,2022
KCT,"Kelappaji College ofAgrl. Engg. & Technology, Tavanur.",G,11366,22928,12726,13097,13258,11657,17587,21482,0,0,0,30881,0,Food Technology,2022
AJC,"Amal Jyothi College of Engineering, Koovapally, Kanjirapally",S,26941,0,31285,27585,27339,36826,0,0,0,0,0,52331,0,Food Technology,2022
MCC,"Musaliar College of Engineering, Chirayinkeezh.",S,36965,0,43530,40258,50999,42396,55888,43038,0,0,0,55255,0,Food Technology,2022
MGP,"Saintgits College of Engineering, Kottayam",S,29668,0,44677,30496,44928,33229,50735,29854,0,0,0,35273,0,Food Technology,2022
SBC,"Sree Buddha College of Engineering, Nooranadu.",S,38308,56373,39283,38418,53339,44284,0,0,0,0,0,49439,0,Food Technology,2022
TKI,"T K M Institute of Technology, Ezhukone, Kollam.",S,22498,0,25052,23011,48199,29130,0,0,22879,0,0,50236,0,Food Technology,2022
