Code,College Name,Type,SM,EW,EZ,MU,BH,LA,DV,VK,BX,KU,KN,SC,ST,Course,Year
SBW,"Sree Buddha College of Engineering, Ayathil",S,50883,0,55895,55368,53779,0,0,0,0,0,0,0,57619,Computer Science and Engineering,2017
SCM,"SCMS School of Engg. & Tech., Ernakulam",S,12350,0,13497,20922,27913,32949,23430,37720,16293,0,58085,0,16092,Computer Science and Engineering,2017
SGT,"Sadguru Swamy Nithyananda Insti. of Tech., Kanhangad, Karsaragod",S,61367,0,0,0,0,0,61462,0,0,0,0,0,0,Computer Science and Engineering,2017
SHM,"Shahul Hameed Memorial Engineering College, Kadakkal.",S,61475,0,0,0,0,0,0,0,0,0,0,0,0,Computer Science and Engineering,2017
SHR,"Sahrdaya College of Engineering and Technology, Kodakara.",S,22931,0,29477,32647,0,34955,42719,0,0,0,58735,0,30134,Computer Science and Engineering,2017
SIT,"Sarabhai Institute of Science & Technology, Vellanad.",S,56190,0,0,0,0,0,61632,0,0,0,0,0,61688,Computer Science and Engineering,2017
SJC,"St. Josephs College of Engineering and Technology,Palai.",S,24133,0,56352,54182,42647,0,57828,0,0,0,0,0,34471,Computer Science and Engineering,2017
SNC,"Sree Narayana Guru College of Engineering & Technology, Payyannur.",S,29561,0,30775,32886,0,0,0,0,0,0,0,0,34776,Computer Science and Engineering,2017
SNG,"Sree Narayana Gurukulam College of Engineering, Kolencherry.",S,33551,0,42460,34150,34940,50394,54350,0,49823,0,58669,0,37848,Computer Science and Engineering,2017
SNM,"Sree Narayana Mangalam Inst. of Mgmt. & Tech., Moothakunnam.",S,49149,0,61235,59801,53784,0,0,0,0,0,0,0,50101,Computer Science and Engineering,2017
SNT,"Sree Narayana Guru Institute of Science & Technology, North Paravoor.",S,51045,0,57811,52666,56760,0,0,0,0,0,0,0,54510,Computer Science and Engineering,2017
SPT,"Sreepathy Institute of Management & Tech., Koottanad.",S,38317,0,41488,54259,0,0,0,0,0,0,55699,0,55901,Computer Science and Engineering,2017
STC,"St. Thomas College of Engineering & Technology, Chengannur.",S,58447,0,0,0,0,0,0,0,0,0,61427,0,0,Computer Science and Engineering,2017
STI,"St. Thomas Institute of Science & Technology, Kattaikonam.",S,51653,0,60554,0,53460,0,0,0,0,0,57697,0,57392,Computer Science and Engineering,2017
STM,"St. Thomas College of Engineering & Technology, Sivapuram, Kannur.",S,46291,0,48676,47216,0,0,0,0,0,0,0,0,49783,Computer Science and Engineering,2017
TCE,"Toms College of Engineering for Startups, Mattakara, Kottayam.",S,60644,0,0,0,0,0,0,0,0,0,0,0,0,Computer Science and Engineering,2017
TJE,"Thejus Engineering College, Erumapetti, Thrissur.",S,39070,0,49098,50175,0,0,48322,0,0,0,60514,0,44568,Computer Science and Engineering,2017
TKI,"T K M Institute of Technology, Ezhukone, Kollam.",S,20209,0,24504,35386,44614,0,0,0,0,0,48895,0,23563,Computer Science and Engineering,2017
TOC,"Toc H Institute of Science & Tech., Mulamthurutthy.",S,23721,0,33128,24363,27563,0,0,0,25334,0,0,0,26196,Computer Science and Engineering,2017
UKP,"UKF College of Engineering & Tech., Parippally.",S,49534,0,52208,0,0,0,59047,0,0,0,61507,0,52078,Computer Science and Engineering,2017
UNT,"Universal Engineering College, Vallivattom, Thrissur.",S,52642,0,53471,0,0,58609,0,0,0,0,60234,0,55975,Computer Science and Engineering,2017
VAS,"Vidya Academy of Science & Technology, Thrissur.",S,20703,0,28401,30148,0,0,25943,0,0,0,45874,0,22320,Computer Science and Engineering,2017
VIT,"Vijnan Institute of Science & Technology, Piravam.",S,61472,0,0,0,0,0,0,0,0,0,0,0,0,Computer Science and Engineering,2017
VJC,"Viswajyothi College of Engineering & Technology,Vazhakulam.",S,17577,0,51163,31404,33451,0,50108,0,0,0,60089,0,26642,Computer Science and Engineering,2017
VKE,"Valia Koonambaikulathamma College of Engg. & tech., Parippally.",S,51234,0,53113,59113,54554,0,0,0,0,53559,0,0,57446,Computer Science and Engineering,2017
VML,"Vimal Jyothi Engineering College, Chemperi.",S,18639,0,39962,0,0,0,28925,0,0,0,56676,0,27738,Computer Science and Engineering,2017
VPE,"Sree Vellappally Natesan College of Engineering, Mavelikkara.",S,57370,0,58399,0,0,0,0,0,0,0,61506,0,61655,Computer Science and Engineering,2017
VVT,"Veda Vyasa Institute of Technology, Ponnempadam, Malappuram.",S,59672,0,0,0,0,0,0,0,0,0,0,0,0,Computer Science and Engineering,2017
YCE,"Younus College of Engineering & Technology, Vadakkevila, Kollam",S,59044,0,59323,0,0,0,61468,0,0,0,0,0,61028,Computer Science and Engineering,2017
YCW,"Younus College of Engineering, Thalachira, Kollam.",S,56107,0,58376,0,0,0,0,0,0,0,0,0,60810,Computer Science and Engineering,2017
CDI,"College of Dairy Science & Tech., Idukki",G,5579,0,6834,9486,9014,0,0,0,0,0,24742,0,8335,Dairy Technology,2017
CDP,"College of Dairy Science & Tech., Pookode Campus, Wayanad.",G,5676,0,6034,0,0,10353,6228,0,48119,25280,14952,0,8025,Dairy Technology,2017
CDT,"College of Dairy Science & Tech., Mannuthy, Thrissur",G,4266,0,5226,4591,7708,0,0,0,0,0,10465,56540,5718,Dairy Technology,2017
CDV,"College of Dairy Science & Tech., KELTRON Complex, Karakulam P O, TVM.",G,5438,0,5904,6472,7599,15261,7973,0,0,0,17069,0,6857,Dairy Technology,2017
MDL,"Model Engineering College, Thrikkakkara.",N,5702,14154,6809,10552,9063,0,0,24156,23671,0,23234,61357,6821,Electronics & Biomedical Engineering,2017
IDK,"Engineering College, Idukki",G,4848,0,9029,7672,16298,21955,9071,0,0,0,39586,45620,8844,Electronics & Communication Engineering,2017
KKE,"Govt. Engineering College, Kozhikkode.",G,4449,0,5128,4991,15593,28660,6568,0,0,0,26112,60000,5310,Electronics & Communication Engineering,2017
KNR,"Govt. College of Engineering, Kannur.",G,4819,0,5989,5850,17357,27714,7379,16952,30993,9376,29521,19692,5952,Electronics & Communication Engineering,2017
KTE,"Govt. Rajiv Gandhi Institute of Tech., Kottayam.",G,2688,0,4649,4927,8811,16317,4202,0,0,0,29775,61061,4080,Electronics & Communication Engineering,2017
MAC,"M A College of Engineering, Kothamangalam.",G,3286,0,4773,4881,7331,16760,4808,17078,17468,11979,35142,61296,4539,Electronics & Communication Engineering,2017
NSS,"N S S College of Engineering, Palakkad.",G,3875,0,5276,4047,14500,28547,5830,14647,27579,28725,30248,0,4729,Electronics & Communication Engineering,2017
PKD,"Govt. Engineering College, Sreekrishnapuram.",G,4831,0,6837,6706,15731,34957,7496,0,41118,30069,34279,0,6760,Electronics & Communication Engineering,2017
TCR,"Govt. Engineering College,Thrissur.",G,1477,0,1986,2218,3760,8073,2186,9477,6925,5653,16965,44220,1906,Electronics & Communication Engineering,2017
TKM,"T K M College of Engineering, Kollam.",G,1297,0,1721,2329,4922,7476,2737,7826,0,20289,18672,14272,1631,Electronics & Communication Engineering,2017
TRV,"Govt. Engineering College, Barton Hills, TVM",G,2233,0,4217,3556,6075,21782,2781,3565,8051,0,15373,50693,3789,Electronics & Communication Engineering,2017
TVE,"College of Engineering,Thiruvananthapuram.",G,342,0,555,538,833,3778,1865,0,0,2135,2930,10605,540,Electronics & Communication Engineering,2017
WYD,"Govt. Engineering College, Mananthavady.",G,4314,0,9107,13146,27020,36672,13615,22035,18856,40086,42927,61004,10419,Electronics & Communication Engineering,2017
ADR,"College of Engineering, Adoor",N,12575,41534,14592,18991,31635,29014,20499,26687,51061,54147,41330,0,14302,Electronics & Communication Engineering,2017
AEC,"College of Engineering, Aranmula, Pathanamthitta.",N,22437,50679,25403,24479,34837,50242,24688,0,0,0,54613,0,26803,Electronics & Communication Engineering,2017
CEA,"College of Engineering, Attingal, Thiruvananthapuram.",N,14527,37532,15391,0,0,0,16243,21637,0,0,44295,0,18092,Electronics & Communication Engineering,2017
CEC,"College of Engineering, Cherthala, Alappuzha.",N,22593,52935,26047,25489,35895,30839,28450,0,35548,0,50895,0,24521,Electronics & Communication Engineering,2017
CEK,"College of Engineering, Kottarakkara, Kollam.",N,23834,56850,26161,26381,33855,51804,26109,38327,0,0,56011,0,25919,Electronics & Communication Engineering,2017
CEM,"College of Engineering, Muttathara.",N,23097,48898,26178,24097,29607,51807,23718,0,0,0,51079,0,25298,Electronics & Communication Engineering,2017
CHN,"College of Engineering, Chengannur, Alappuzha.",N,9568,32897,12834,14872,20107,32306,10464,26640,52202,0,54128,0,11022,Electronics & Communication Engineering,2017
KGR,"College of Engineering, Kidangoor.",N,17315,55765,25606,26634,35641,19233,36095,20817,0,0,57083,0,20725,Electronics & Communication Engineering,2017
KNP,"College of Engineering, Karunagappally.",N,21952,58016,24800,26886,40816,41922,27017,0,0,0,56967,0,25413,Electronics & Communication Engineering,2017
KSD,"LBS College of Engineering, Kasaragod.",N,17149,47194,18998,17232,42326,54944,24615,44685,0,52318,52824,60208,18385,Electronics & Communication Engineering,2017
LBT,"LBS Institute of Tech. for Women, Poojapura, TVPM",N,7226,18526,10632,8741,13381,0,0,17568,0,16282,37842,0,9691,Electronics & Communication Engineering,2017
MDL,"Model Engineering College, Thrikkakkara.",N,2620,5649,4766,5663,4818,3923,3212,0,14741,7164,32694,0,3987,Electronics & Communication Engineering,2017
MNR,"College of Engineering, Munnar.",N,24570,57809,26926,25268,37039,42920,28651,0,0,0,53728,0,25261,Electronics & Communication Engineering,2017
PEC,College of Engineering Pathanapuram.,N,25040,58233,27730,26942,46101,54333,0,0,0,0,57594,0,27416,Electronics & Communication Engineering,2017
PJR,"College of Engineering, Poonjar.",N,26730,61463,29266,28000,36701,0,27119,60400,0,0,59255,0,28500,Electronics & Communication Engineering,2017
PRN,College of Engineering Perumon.,N,18780,53217,25218,25872,28225,55050,24756,52367,0,0,55788,0,24225,Electronics & Communication Engineering,2017
PRP,"College of Engineering & Management, Punnapra.",N,27072,61397,29472,27781,37913,34269,29610,0,0,0,58713,0,29460,Electronics & Communication Engineering,2017
PTA,"College of Engineering, Kallooppara.",N,24049,57921,28997,29027,47566,0,0,0,0,0,59300,0,25615,Electronics & Communication Engineering,2017
SCT,"S C T College of Engineering, Pappanamcode.",N,5403,12390,8669,6923,9175,31163,5634,10268,0,34594,29555,0,6566,Electronics & Communication Engineering,2017
TKR,"College of Engineering, Thrikarippur, Kasaragod.",N,18433,43704,20130,20096,0,55568,21266,0,0,50930,59643,0,19877,Electronics & Communication Engineering,2017
TLY,"College of Engineering, Thalassery, Kannur.",N,14871,36515,19273,17170,48152,48837,18076,25567,0,0,51156,0,16563,Electronics & Communication Engineering,2017
UCC,"Calicut Unity. Institute of Engineering & Tech., Tenhipalam.",N,17991,0,19175,18854,49201,57450,28541,41438,0,31063,54127,0,22787,Electronics & Communication Engineering,2017
UCE,"University College of Engineering,Thodupuzha.",N,26862,0,30973,27195,31668,56345,31271,0,0,0,59043,0,28821,Electronics & Communication Engineering,2017
UCK,"University College of Engineering, Kariavattom.",N,11139,30585,13695,16388,15316,0,0,17089,0,0,39897,0,11876,Electronics & Communication Engineering,2017
VDA,"College of Engineering, Vadakara, Kozhikode.",N,15380,37133,16079,15440,44043,46456,16375,0,0,0,47103,0,17815,Electronics & Communication Engineering,2017
AAE,"AlAzhar College of Engineering & Technology, Thodupuzha.",S,56253,0,56644,0,0,0,0,0,0,0,61589,0,0,Electronics & Communication Engineering,2017
AAP,"AlAmeen College of Engineering, Pattambi.",S,60581,0,0,0,0,0,0,0,0,0,0,0,0,Electronics & Communication Engineering,2017
AIK,"Albertian Institute of Science and Technology, Kalamassery.",S,42517,0,43617,58849,43069,0,0,0,0,0,52077,0,0,Electronics & Communication Engineering,2017
AJC,"Amal Jyothi College of Engineering, Koovapally P O, Kanjirapally.",S,23316,0,42049,35447,26661,0,29455,0,0,0,60524,0,32403,Electronics & Communication Engineering,2017
AME,"Ammini College of Engineering, Mankara, Palakkad.",S,52076,0,0,53581,0,0,0,0,0,0,58568,0,57557,Electronics & Communication Engineering,2017
ANE,"Aryanet Institute of Technology, Vadakkente Kadu, Mundoor, Palakkad.",S,60740,0,0,0,0,0,0,0,0,0,0,0,0,Electronics & Communication Engineering,2017
ASI,"Adi Sankara Institute of Engg. & Tech., Kalady, Ernakulam.",S,23594,0,33644,38202,28379,47664,32684,0,0,0,60624,0,32792,Electronics & Communication Engineering,2017
ATP,"Ahalia School of Engineering & Technology, Pudussery, Palakkad.",S,43654,0,61458,46355,0,0,0,0,0,0,0,0,45890,Electronics & Communication Engineering,2017
AWH,"AWH Engineering College, Kozhikkode",S,33264,0,40567,0,0,0,0,0,0,0,51317,0,38723,Electronics & Communication Engineering,2017
AXE,"Axis College of Engineering & Technology, Murikkingal, Thrissur.",S,61416,0,0,0,0,0,0,0,0,0,0,0,0,Electronics & Communication Engineering,2017
BJK,"Bishop Jerome Institute, Kollam.",S,40335,0,0,0,45674,0,55698,0,0,0,61525,0,40839,Electronics & Communication Engineering,2017
BMC,"Baselios Mathew II College of Engg., Sasthamcotta, Kollam.",S,43001,0,52866,0,51005,0,48266,0,0,0,60240,0,56758,Electronics & Communication Engineering,2017
BTE,"Baselios Thomas I Catholicose College of Engg. &Tech., Koothattukulam.",S,60258,0,0,0,0,0,0,0,0,0,0,0,0,Electronics & Communication Engineering,2017
CCE,"Christ College of Engineering, Irinjalakuda.",S,24779,0,33312,0,0,0,32256,0,0,31871,0,0,26662,Electronics & Communication Engineering,2017
CCV,"Cochin College of Engineering  and Technology, Valanchery, Malappuram.",S,60504,0,0,0,0,0,0,0,0,0,0,0,0,Electronics & Communication Engineering,2017
CEN,"College of Engineering and Technology, Payyannur, Kannur.",S,42664,0,45070,42825,0,49397,45817,0,0,0,0,0,45297,Electronics & Communication Engineering,2017
CIM,"Cochin Institute of Science and Technology, Muvattupuzha.",S,57451,0,58561,0,0,0,0,0,0,0,0,0,0,Electronics & Communication Engineering,2017
CKC,"Christ Knowledge City for Women, Kuzhoor,EKM",S,38349,0,0,0,0,0,0,0,0,0,0,0,0,Electronics & Communication Engineering,2017
CML,"Believers Church Caarmel Engineering College, Ranni.",S,50295,0,0,0,0,0,0,0,0,0,61409,0,0,Electronics & Communication Engineering,2017
DMC,"M Dasan Memmorial Coop. Inst. of Engineering & Inf. Tech., Koyilandy.",S,57050,0,60708,0,0,0,0,0,0,0,0,0,58856,Electronics & Communication Engineering,2017
ECE,"Sree Ernakulathappan College of Engineering & Mgmnt., Mukundapuram.",S,50384,0,0,0,0,0,0,0,0,0,0,0,0,Electronics & Communication Engineering,2017
EKC,"Eranad Knowledgecity Technical Campus, Cherukulam, Malappuram.",S,55077,0,59566,0,0,0,0,0,0,0,0,0,0,Electronics & Communication Engineering,2017
FIT,"Federal Institute of Science & Tech., Angamaly.",S,10524,0,17239,11443,25250,35411,24545,0,0,0,60593,0,13293,Electronics & Communication Engineering,2017
FOP,"Focus Institute of Science and Technology, Poomala, Thrissur.",S,60744,0,0,0,0,0,0,0,0,0,0,0,0,Electronics & Communication Engineering,2017
GIT,"Gurudeva Institute of Science & Technology, Puthuppally.",S,57195,0,0,0,0,0,0,0,0,0,0,0,0,Electronics & Communication Engineering,2017
GWE,"K R Gouri Amma College of Engineering, Thuravoor, Cherthala.",S,60086,0,0,0,0,0,0,0,0,0,0,0,0,Electronics & Communication Engineering,2017
HCE,"Heera College of Engineering & Technology, Nedumangad.",S,56480,0,0,57374,58294,0,0,0,0,0,60663,0,0,Electronics & Communication Engineering,2017
HGW,"Holy Grace Academy of Engineering, Mala, Thrissur.",S,59613,0,0,0,0,0,0,0,0,0,0,0,0,Electronics & Communication Engineering,2017
HKC,"Holy Kings College of Engineering & Technology, Moovattupuzha.",S,60430,0,0,0,0,0,0,0,0,0,0,0,0,Electronics & Communication Engineering,2017
HKE,"Hindustan College of Engineering, Kulathupuzha.",S,0,0,0,0,0,0,0,0,0,0,0,0,0,Electronics & Communication Engineering,2017
ICE,"Ilahia College of Engineering & Tech., Moovattupuzha.",S,61538,0,0,0,0,0,0,0,0,0,0,0,0,Electronics & Communication Engineering,2017
ICT,"Ilahia School of Science & Technology, Muvattupuzha.",S,47792,0,0,0,0,0,0,0,0,0,0,0,0,Electronics & Communication Engineering,2017
IES,"I E S College of Engineering, Chittilappilly.",S,56823,0,0,0,0,0,0,0,0,0,0,0,0,Electronics & Communication Engineering,2017
IGW,"Indira Gandhi Inst. of Engineering & Tech., Kothamangalam",S,55388,0,0,0,0,0,0,0,0,0,0,0,0,Electronics & Communication Engineering,2017
ILE,"ILM College of Engineering, Perumbavoor, Ernakulam.",S,55782,0,0,0,0,0,0,0,0,0,0,0,0,Electronics & Communication Engineering,2017
JBT,"Jai Bharath College of Management & Engineering Tech., Perumbavoor.",S,58601,0,0,0,0,0,0,0,0,0,0,0,0,Electronics & Communication Engineering,2017
JCE,"Jawaharlal College of Engineering & Technology, Ottappalam.",S,61135,0,0,0,0,0,0,0,0,0,0,0,0,Electronics & Communication Engineering,2017
JEC,"Jyothi Engineering College, Cheruthuruthy.",S,32457,0,50010,34347,0,0,36383,0,0,0,60898,0,41104,Electronics & Communication Engineering,2017
JIT,"John Cox Memorial CSI Institute of Technology, Thiruvananthapuram.",S,51636,0,53922,58675,0,0,0,0,0,0,0,0,0,Electronics & Communication Engineering,2017
KIT,"Kottayam Institute of Technonolgy & Science, Pallicathode, Kottayam.",S,59130,0,0,0,0,0,0,0,0,0,0,0,0,Electronics & Communication Engineering,2017
KMC,"KMCT College of  Engineering, Kozhikkode.",S,57518,0,59772,60551,0,0,0,0,0,0,0,0,58240,Electronics & Communication Engineering,2017
KME,"K M E A Engineering College, Edathala.",S,41941,0,44032,0,0,55638,0,0,0,0,0,0,52346,Electronics & Communication Engineering,2017
KMP,"KMP College of Engineering, Perumbavoor.",S,53049,0,0,0,0,0,0,0,0,0,0,0,0,Electronics & Communication Engineering,2017
LMC,"Lourdes Matha College of Science and Technology, Kuttichal.",S,56315,0,58967,0,0,0,61033,0,0,0,58195,0,0,Electronics & Communication Engineering,2017
MBC,"Mar Baselios Christian College of Engg. & Tech., Peermede.",S,59755,0,0,0,0,0,0,0,0,0,0,0,0,Electronics & Communication Engineering,2017
MBI,"Mar Baselios Institute of Technology & Science, Kothamangalam.",S,41742,0,50784,0,0,0,0,0,0,0,0,0,48660,Electronics & Communication Engineering,2017
MBT,"Mar Baselious College of Engineering & Technology, Thiruvananthapuram.",S,15726,0,29759,16816,16998,54222,23845,0,0,50991,45954,0,29419,Electronics & Communication Engineering,2017
MCC,"Musaliar College of Engineering, Chirayinkeezh.",S,58632,0,0,0,0,0,0,0,0,0,0,0,0,Electronics & Communication Engineering,2017
MCE,"Marian Engineering College, Kazhakuttom.",S,36070,0,46064,37678,36911,0,49809,55872,0,0,61261,0,45539,Electronics & Communication Engineering,2017
MCK,"Musaliar College of Engineering & Tech., Pathanamthitta.",S,59473,0,0,0,0,0,0,0,0,0,0,0,0,Electronics & Communication Engineering,2017
MCT,"Mohandas College of Engg. & Tech., Nedumangad.",S,43387,0,53395,47489,0,0,52378,56215,0,0,56755,0,53386,Electronics & Communication Engineering,2017
MEA,"M E A Engineering College, Malappuram.",S,43969,0,47433,0,0,0,44354,0,0,0,0,0,45996,Electronics & Communication Engineering,2017
MEC,"Malabar College of Engineering & Tech., Wadakancherry.",S,58492,0,0,0,0,0,0,0,0,0,0,0,0,Electronics & Communication Engineering,2017
MEE,"MES College of Engineering & Technology, .Ernakulam.",S,57915,0,58929,0,0,0,0,0,0,0,0,0,59577,Electronics & Communication Engineering,2017
MEK,"MES Institute of Tech. & Management, Chathannoor.",S,57767,0,0,0,0,0,0,0,0,0,0,0,0,Electronics & Communication Engineering,2017
MES,"M E S College of Engineering, Kuttippuram.",S,27071,0,30377,34324,59523,0,48717,0,0,0,57927,0,33710,Electronics & Communication Engineering,2017
MET,"Met's School of Engineering, Mala.",S,59311,0,0,0,0,0,0,0,0,0,0,0,0,Electronics & Communication Engineering,2017
MGC,"M G College of Engineering, Thiruvallom.",S,54273,0,61464,0,0,0,0,59193,0,0,61601,0,57048,Electronics & Communication Engineering,2017
MGP,"Saintgits College of Engineering, Kottayam",S,26979,0,53923,31441,47464,0,40975,0,0,0,57484,0,33438,Electronics & Communication Engineering,2017
MHP,"Ace College of Engineering, .Thiruvallam.",S,55606,0,56946,0,58587,0,0,0,0,0,0,0,0,Electronics & Communication Engineering,2017
MLM,"Mangalam College of Engineering, Ettumanoor.",S,59840,0,0,0,0,0,0,0,0,0,0,0,0,Electronics & Communication Engineering,2017
MLT,"Malabar Institute of Technology, Anjarakandi.",S,52396,0,57877,0,0,0,0,0,0,0,0,0,55296,Electronics & Communication Engineering,2017
MTA,"Matha College of Technology, North Pravur.",S,0,0,0,0,0,0,0,0,0,0,0,0,0,Electronics & Communication Engineering,2017
MUS,"Muslim Association College of Engineering, Venjaramoodu.",S,37707,0,0,0,0,0,0,0,0,0,0,0,0,Electronics & Communication Engineering,2017
MUT,"Muthoot Institute of Technology & Science, Puthencurz, Ernakulam.",S,13710,0,17727,16338,27140,0,0,33455,49352,0,59060,0,18260,Electronics & Communication Engineering,2017
MZC,"Mount Zion College of Engg., Pathanamthitta.",S,56317,0,0,0,0,0,0,0,0,0,0,0,0,Electronics & Communication Engineering,2017
MZW,"Mount Zion Institute of Science & Tehnology, Chengannur",S,43222,0,0,0,0,0,0,0,0,0,0,0,0,Electronics & Communication Engineering,2017
NCE,"Nehru College of Engg. & Research Centre, Thiruvillwamala.",S,59689,0,0,0,0,0,0,0,0,0,0,0,0,Electronics & Communication Engineering,2017
NML,"North Malabar Institute of Technology, Kanhangad.",S,58329,0,59883,0,0,0,0,0,0,0,0,0,0,Electronics & Communication Engineering,2017
PCE,"Prime College of Engineering, Erattayal, Palakkad",S,60926,0,0,0,0,0,0,0,0,0,0,0,0,Electronics & Communication Engineering,2017
PRC,"Providence College of Engineering, Chengannur.",S,59923,0,0,0,0,0,0,0,0,0,0,0,0,Electronics & Communication Engineering,2017
RCE,"Royal College of Engineering & Technology, Thrissur.",S,60345,0,0,0,0,0,0,0,0,0,0,0,0,Electronics & Communication Engineering,2017
RET,"Rajagiri School of Engineering and Technology, Kochi.",S,7966,0,15886,12587,12536,19376,10357,27061,15430,0,58694,0,12754,Electronics & Communication Engineering,2017
RIE,"Rajadhani Institute of Engineering & Tech., Attingal.",S,56116,0,0,0,0,0,59403,0,0,0,59410,0,61534,Electronics & Communication Engineering,2017
SBC,"Sree Buddha College of Engineering, Nooranadu.",S,43592,0,47176,44917,0,0,0,0,0,0,61050,0,61298,Electronics & Communication Engineering,2017
SBW,"Sree Buddha College of Engineering, Ayathil",S,61297,0,0,0,0,0,0,0,0,0,0,0,0,Electronics & Communication Engineering,2017
SCM,"SCMS School of Engg. & Tech., Ernakulam",S,18657,0,23453,25537,26732,21560,19460,54707,32702,0,0,0,20766,Electronics & Communication Engineering,2017
SGT,"Sadguru Swamy Nithyananda Insti. of Tech., Kanhangad, Karsaragod",S,58520,0,0,0,0,0,0,0,0,0,0,0,0,Electronics & Communication Engineering,2017
SHM,"Shahul Hameed Memorial Engineering College, Kadakkal.",S,60129,0,0,0,0,0,0,0,0,0,0,0,0,Electronics & Communication Engineering,2017
SHR,"Sahrdaya College of Engineering and Technology, Kodakara.",S,27084,0,58911,45556,0,43732,0,0,0,0,55544,0,35709,Electronics & Communication Engineering,2017
SIT,"Sarabhai Institute of Science & Technology, Vellanad.",S,61686,0,0,0,0,0,0,0,0,0,0,0,0,Electronics & Communication Engineering,2017
SJC,"St. Josephs College of Engineering and Technology,Palai.",S,31605,0,38461,53551,46628,0,0,51148,0,0,0,0,59406,Electronics & Communication Engineering,2017
SNC,"Sree Narayana Guru College of Engineering & Technology, Payyannur.",S,37283,0,45199,0,0,0,0,0,0,0,0,0,0,Electronics & Communication Engineering,2017
SNG,"Sree Narayana Gurukulam College of Engineering, Kolencherry.",S,46459,0,56697,48402,58167,49289,0,0,0,0,0,0,60884,Electronics & Communication Engineering,2017
SNM,"Sree Narayana Mangalam Inst. of Mgmt. & Tech., Moothakunnam.",S,61133,0,0,0,0,0,0,0,0,0,0,0,0,Electronics & Communication Engineering,2017
SNP,"Sree Narayana Institute of Technology, Adoor.",S,60686,0,0,0,0,0,0,0,0,0,0,0,0,Electronics & Communication Engineering,2017
SNT,"Sree Narayana Guru Institute of Science & Technology, North Paravoor.",S,59275,0,0,0,0,0,0,0,0,0,0,0,0,Electronics & Communication Engineering,2017
SPT,"Sreepathy Institute of Management & Tech., Koottanad.",S,48659,0,0,0,0,0,49888,0,0,0,59282,0,0,Electronics & Communication Engineering,2017
STC,"St. Thomas College of Engineering & Technology, Chengannur.",S,61393,0,0,0,0,0,0,0,0,0,0,0,0,Electronics & Communication Engineering,2017
STI,"St. Thomas Institute of Science & Technology, Kattaikonam.",S,58952,0,0,0,0,0,0,0,0,0,0,0,0,Electronics & Communication Engineering,2017
STM,"St. Thomas College of Engineering & Technology, Sivapuram, Kannur.",S,56848,0,57691,57028,0,0,0,0,0,0,0,0,61146,Electronics & Communication Engineering,2017
TCT,"Trinity College of Engineering, Neruvamoodu, Thiruvananthapuram.",S,60605,0,0,0,0,0,0,0,0,0,0,0,0,Electronics & Communication Engineering,2017
TJE,"Thejus Engineering College, Erumapetti, Thrissur.",S,61611,0,0,0,0,0,0,0,0,0,0,0,0,Electronics & Communication Engineering,2017
TOC,"Toc H Institute of Science & Tech., Mulamthurutthy.",S,37750,0,50863,41635,44096,44292,48350,0,0,0,0,0,55004,Electronics & Communication Engineering,2017
UKP,"UKF College of Engineering & Tech., Parippally.",S,60858,0,0,0,0,0,0,0,0,0,0,0,0,Electronics & Communication Engineering,2017
UNT,"Universal Engineering College, Vallivattom, Thrissur.",S,58190,0,0,0,0,0,0,0,0,0,0,0,0,Electronics & Communication Engineering,2017
VAK,"Vidya Academy of Science & Technology Technical Campus, Kilimanoor.",S,61106,0,0,0,0,0,0,0,0,0,0,0,0,Electronics & Communication Engineering,2017
VAS,"Vidya Academy of Science & Technology, Thrissur.",S,23476,0,37453,23837,54022,0,31547,0,0,0,60362,0,26465,Electronics & Communication Engineering,2017
VIT,"Vijnan Institute of Science & Technology, Piravam.",S,60968,0,0,0,0,0,0,0,0,0,0,0,0,Electronics & Communication Engineering,2017
VJC,"Viswajyothi College of Engineering & Technology,Vazhakulam.",S,24286,0,56709,45704,43506,0,56958,0,0,0,47755,0,40689,Electronics & Communication Engineering,2017
VKE,"Valia Koonambaikulathamma College of Engg. & tech., Parippally.",S,60505,0,60869,0,0,0,0,0,0,0,0,0,0,Electronics & Communication Engineering,2017
VML,"Vimal Jyothi Engineering College, Chemperi.",S,32363,0,43658,35528,56625,0,0,0,0,56525,61121,0,40898,Electronics & Communication Engineering,2017
VPE,"Sree Vellappally Natesan College of Engineering, Mavelikkara.",S,61432,0,0,0,0,0,0,0,0,0,0,0,0,Electronics & Communication Engineering,2017
