Code,College Name,Type,SM,EW,EZ,MU,BH,LA,DV,VK,BX,KU,KN,SC,ST,Course,Year
HGW,"Holy Grace Academy of Engineering, Mala, Thrissur.",S,43745,0,0,0,0,0,0,0,0,0,0,0,0,Civil Engineering,2018
HKE,"Hindustan College of Engineering, Kulathupuzha.",S,35944,0,42495,0,0,46078,0,0,0,0,0,0,0,Civil Engineering,2018
ICE,"Ilahia College of Engineering & Tech., Moovattupuzha.",S,42933,0,0,44667,0,0,0,0,0,0,0,45070,0,Civil Engineering,2018
ICT,"Ilahia School of Science & Technology, Muvattupuzha.",S,46377,0,0,0,0,0,0,0,0,0,0,0,0,Civil Engineering,2018
IES,"I E S College of Engineering, Chittilappilly.",S,43017,0,0,0,43071,0,0,0,0,0,0,44557,0,Civil Engineering,2018
IGW,"Indira Gandhi Inst. of Engineering & Tech., Kothamangalam",S,40526,0,44661,44086,0,41201,0,0,0,0,0,0,41009,Civil Engineering,2018
ILE,"ILM College of Engineering, Perumbavoor, Ernakulam.",S,45916,0,0,0,0,0,0,0,0,0,0,0,0,Civil Engineering,2018
JBT,"Jai Bharath College of Management & Engg. Tech., Perumbavoor.",S,45867,0,0,0,0,0,0,0,0,0,0,0,0,Civil Engineering,2018
JCE,"Jawaharlal College of Engineering & Technology, Ottappalam.",S,46322,0,0,0,0,0,0,0,0,0,0,0,0,Civil Engineering,2018
JEC,"Jyothi Engineering College, Cheruthuruthy.",S,24866,0,28656,26550,34103,40577,41215,32813,0,0,0,40798,0,Civil Engineering,2018
JIT,"John Cox Memorial CSI Institute of Technology, Thiruvananthapuram.",S,36914,0,41277,45508,0,0,0,0,39563,0,0,44499,0,Civil Engineering,2018
KIT,"Kottayam Institute of Tech. & Science, Pallicathode, Kottayam.",S,38661,0,0,0,0,0,0,0,0,0,0,0,0,Civil Engineering,2018
KMC,"KMCT College of  Engineering, Kozhikkode.",S,38107,0,41992,41055,0,0,0,0,0,0,0,41961,0,Civil Engineering,2018
KME,"K M E A Engineering College, Edathala.",S,37972,0,43215,39358,0,38133,0,0,0,0,0,46137,0,Civil Engineering,2018
KMW,"KMCT College of  Engineering for Women, Manassery.",S,43848,0,0,0,0,0,0,0,0,0,0,0,0,Civil Engineering,2018
LMC,"Lourdes Matha College of Science and Technology, Kuttichal.",S,37963,0,40413,0,42959,0,0,0,0,0,0,46598,0,Civil Engineering,2018
MBC,"Mar Baselios Christian College of Engg. & Tech., Peermede.",S,33366,0,0,43861,39060,0,0,38947,0,0,0,46276,46253,Civil Engineering,2018
MBI,"Mar Baselios Institute of Technology & Science, Kothamangalam.",S,30891,0,42306,34019,36598,39390,0,0,39834,0,0,0,0,Civil Engineering,2018
MBT,"Mar Baselious College of Engg. & Tech., Thiruvananthapuram.",S,15181,0,16040,20589,18018,28290,35442,36469,0,0,0,31268,0,Civil Engineering,2018
MCC,"Musaliar College of Engineering, Chirayinkeezh.",S,43318,0,0,43834,0,44413,0,0,0,0,0,0,0,Civil Engineering,2018
MCE,"Marian Engineering College, Kazhakuttom.",S,26178,0,29202,28354,26746,29264,43169,27691,0,41240,0,40150,0,Civil Engineering,2018
MCK,"Musaliar College of Engineering & Tech., Pathanamthitta.",S,45670,0,0,0,0,0,0,0,0,0,0,0,0,Civil Engineering,2018
MCT,"Mohandas College of Engg. & Tech., Nedumangad.",S,30839,0,39728,38776,35674,0,0,0,41021,0,0,41390,46128,Civil Engineering,2018
MEA,"M E A Engineering College, Malappuram.",S,23914,0,43707,25628,31712,0,0,36293,0,0,0,46125,0,Civil Engineering,2018
MEC,"Malabar College of Engineering & Tech., Wadakancherry.",S,34728,0,0,0,0,0,0,0,0,0,0,0,0,Civil Engineering,2018
MEE,"MES College of Engineering & Technology, .Ernakulam.",S,36794,0,41180,42533,0,38605,39345,0,0,39645,0,46475,0,Civil Engineering,2018
MEK,"MES Institute of Tech. & Management, Chathannoor.",S,34684,0,44022,36524,0,45769,0,35651,0,0,0,0,0,Civil Engineering,2018
MES,"M E S College of Engineering, Kuttippuram.",S,12012,0,21517,12966,12024,0,26847,0,0,0,0,36689,0,Civil Engineering,2018
MET,"Met's School of Engineering, Mala.",S,45090,0,0,0,0,0,0,0,0,0,0,0,0,Civil Engineering,2018
MGE,"MGM College of Engineering & Technology, Ernakulam",S,44115,0,0,0,0,0,0,0,0,0,0,0,0,Civil Engineering,2018
MGP,"Saintgits College of Engineering, Kottayam",S,23820,0,33698,29494,36542,30894,32577,24873,24807,0,0,46564,0,Civil Engineering,2018
MHP,"Ace College of Engineering, .Thiruvallam.",S,35553,0,43012,45407,0,0,44857,38981,0,0,0,45146,0,Civil Engineering,2018
MLM,"Mangalam College of Engineering, Ettumanoor.",S,45937,0,0,0,0,0,0,0,0,0,0,0,0,Civil Engineering,2018
MLT,"Malabar Institute of Technology, Anjarakandi.",S,46180,0,0,0,0,0,0,0,0,0,0,0,0,Civil Engineering,2018
MTA,"Matha College of Technology, North Pravur.",S,32162,0,0,0,0,0,0,0,0,0,0,0,0,Civil Engineering,2018
MUS,"Muslim Association College of Engineering, Venjaramoodu.",S,45327,0,0,0,0,0,0,0,0,0,0,0,0,Civil Engineering,2018
MUT,"Muthoot Institute of Tech. & Science, Puthencurz, Ernakulam.",S,14133,0,18754,17564,0,0,25290,41408,41366,44256,0,41279,0,Civil Engineering,2018
MZC,"Mount Zion College of Engg., Pathanamthitta.",S,46059,0,0,0,0,0,0,0,0,0,0,0,0,Civil Engineering,2018
MZW,"Mount Zion Institute of Science & Tehnology, Chengannur",S,43956,0,0,0,0,0,0,0,0,0,0,0,0,Civil Engineering,2018
NIE,"Nirmala College of Engineering, Chalakudy.",S,35734,0,0,0,0,0,0,0,0,0,0,0,0,Civil Engineering,2018
NML,"North Malabar Institute of Technology, Kanhangad.",S,43460,0,0,0,0,0,0,0,0,0,0,0,0,Civil Engineering,2018
PRC,"Providence College of Engineering, Chengannur.",S,39791,0,45695,44752,0,0,0,0,0,0,0,45527,0,Civil Engineering,2018
PRS,"PRS College of Engineering & Tech., Neyyattinkara.",S,46203,0,0,0,0,0,0,0,0,0,0,0,0,Civil Engineering,2018
RCE,"Royal College of Engineering & Technology, Thrissur.",S,31838,0,37067,35849,0,0,0,0,0,0,0,46622,0,Civil Engineering,2018
RET,"Rajagiri School of Engineering and Technology, Kochi.",S,8387,0,12014,8821,9736,10601,0,0,0,34087,28053,24625,0,Civil Engineering,2018
RIE,"Rajadhani Institute of Engineering & Tech., Attingal.",S,39693,0,43478,45617,42364,39786,0,0,0,0,0,46492,0,Civil Engineering,2018
SBC,"Sree Buddha College of Engineering, Nooranadu.",S,27731,0,31337,32373,0,0,0,0,0,0,0,40983,0,Civil Engineering,2018
SBW,"Sree Buddha College of Engineering, Ayathil",S,44064,0,44967,0,0,0,0,0,0,0,0,0,0,Civil Engineering,2018
SCM,"SCMS School of Engg. & Tech., Ernakulam",S,21555,0,25457,24580,22045,27687,24598,23823,37626,39931,0,46593,0,Civil Engineering,2018
SGT,"Sadguru Swamy Nithyananda Insti. of Tech., Karsaragod",S,45608,0,0,0,0,0,0,0,0,0,0,0,0,Civil Engineering,2018
SHR,"Sahrdaya College of Engineering and Technology, Kodakara.",S,24915,0,27369,30257,32388,40929,0,0,0,0,0,46291,0,Civil Engineering,2018
SIT,"Sarabhai Institute of Science & Technology, Vellanad.",S,44681,0,0,0,0,0,0,0,0,0,0,0,0,Civil Engineering,2018
SJC,"St. Josephs College of Engineering and Technology,Palai.",S,26884,0,35615,30283,0,43435,0,0,41564,0,0,0,0,Civil Engineering,2018
SNC,"Sree Narayana Guru College of Engg & Technology, Payyannur.",S,34843,0,36184,38705,0,0,0,0,0,0,0,45710,0,Civil Engineering,2018
SNG,"Sree Narayana Gurukulam College of Engineering, Kolencherry.",S,38454,0,42425,43847,40997,0,0,44592,0,0,0,0,0,Civil Engineering,2018
SNM,"Sree Narayana Mangalam Inst. of Mgmt. & Tech., Moothakunnam.",S,46093,0,0,0,0,0,0,0,0,0,0,0,0,Civil Engineering,2018
SNP,"Sree Narayana Institute of Technology, Adoor",S,41847,0,46501,44801,0,0,0,0,0,0,0,0,0,Civil Engineering,2018
SNT,"Sree Narayana Guru Institute of Science & Tech., N. Paravoor.",S,44880,0,0,0,0,0,0,0,0,0,0,0,0,Civil Engineering,2018
SPT,"Sreepathy Institute of Management & Tech., Koottanad.",S,46393,0,0,0,0,0,0,0,0,0,0,0,0,Civil Engineering,2018
STC,"St. Thomas College of Engg. & Technology, Chengannur.",S,45166,0,0,0,0,0,0,0,0,0,0,0,0,Civil Engineering,2018
STI,"St. Thomas Institute of Science & Technology, Kattaikonam.",S,46396,0,0,0,0,0,0,0,0,0,0,0,0,Civil Engineering,2018
STM,"St. Thomas College of Engineering & Technology,  Kannur.",S,42109,0,44397,44610,0,0,0,0,0,0,0,0,46094,Civil Engineering,2018
TCE,"Toms College of Engg. for Startups, Mattakara, Kottayam.",S,46516,0,0,0,0,0,0,0,0,0,0,0,0,Civil Engineering,2018
TCT,"Trinity College of Engg, Neruvamoodu, Thiruvananthapuram.",S,45870,0,0,0,0,0,0,0,0,0,0,46588,0,Civil Engineering,2018
TJE,"Thejus Engineering College, Erumapetti, Thrissur.",S,40254,0,44490,46142,44004,0,0,42760,0,0,0,45794,0,Civil Engineering,2018
TKI,"T K M Institute of Technology, Ezhukone, Kollam.",S,20783,0,21845,20833,0,0,0,23774,0,0,39335,43901,0,Civil Engineering,2018
TOC,"Toc H Institute of Science & Tech., Mulamthurutthy.",S,26067,0,34130,27449,39216,29398,0,0,0,0,0,42884,0,Civil Engineering,2018
UKP,"UKF College of Engineering & Tech., Parippally.",S,36613,0,40951,39260,0,44798,40550,0,0,0,0,0,0,Civil Engineering,2018
UNT,"Universal Engineering College, Vallivattom, Thrissur.",S,45955,0,0,0,0,0,0,0,0,0,0,0,0,Civil Engineering,2018
VAK,"Vidya Academy of Science & Technology, Kilimanoor.",S,29528,0,37507,41834,39530,0,0,42293,0,0,0,45619,0,Civil Engineering,2018
VAS,"Vidya Academy of Science & Technology, Thrissur.",S,22394,0,27519,30864,31487,45906,38329,24337,0,0,0,42594,0,Civil Engineering,2018
VIT,"Vijnan Institute of Science & Technology, Piravam.",S,44342,0,0,0,0,0,0,0,0,0,0,0,0,Civil Engineering,2018
VJC,"Viswajyothi College of Engg. & Technology,Vazhakulam.",S,21622,0,28392,29051,28519,0,37981,0,0,0,0,44581,44582,Civil Engineering,2018
VKE,"Valia Koonambaikulathamma College of Engg. & tech., Parippally.",S,34191,0,36071,45977,45872,36055,0,0,0,0,0,42179,0,Civil Engineering,2018
VML,"Vimal Jyothi Engineering College, Chemperi.",S,26274,0,37377,34216,26965,0,0,35571,0,0,0,46506,0,Civil Engineering,2018
VPE,"Sree Vellappally Natesan College of Engg, Mavelikkara.",S,46572,0,0,0,0,0,0,0,0,0,0,0,0,Civil Engineering,2018
VVT,"Veda Vyasa Institute of Technology, Ponnempadam, Malappuram.",S,46112,0,0,0,0,0,0,0,0,0,0,0,0,Civil Engineering,2018
YCE,"Younus College of Engg. & Technology, Vadakkevila, Kollam",S,37634,0,43794,39716,40729,44000,0,41637,0,0,0,46366,0,Civil Engineering,2018
YCK,"Younus Institute of Technology, Kannanaloor, Kollam",S,46519,0,0,0,0,0,0,0,0,0,0,0,0,Civil Engineering,2018
KKE,"Govt. Engineering College, Kozhikkode.",G,4190,0,5975,6771,7213,10534,14324,5894,0,0,0,27423,34537,Chemical Engineering,2018
TCR,"Govt. Engineering College,Thrissur.",G,2705,0,3331,3900,3216,4568,11798,0,7636,9539,11995,14928,0,Chemical Engineering,2018
TKM,"T K M College of Engineering, Kollam.",G,3237,0,3889,4217,4082,6192,12949,4378,0,0,0,27602,35308,Chemical Engineering,2018
AJC,"Amal Jyothi College of Engineering, Koovapally P O, Kanjirapally.",S,11978,0,13642,14745,0,0,0,34055,25239,0,0,38049,0,Chemical Engineering,2018
CCV,"Cochin College of Engg.  and Technology, Valanchery, Malappuram.",S,20167,0,24930,23063,23243,27695,31771,34805,0,0,0,34701,0,Chemical Engineering,2018
MGP,"Saintgits College of Engineering, Kottayam",S,23538,0,25918,29094,29681,30861,44560,39280,27985,0,0,44461,0,Chemical Engineering,2018
TCE,"Toms College of Engg. for Startups, Mattakara, Kottayam.",S,20517,0,22145,23684,24145,23534,0,0,0,0,0,40473,0,Chemical Engineering,2018
IDK,"Engineering College, Idukki",G,3712,0,9580,9354,10976,22136,20118,14188,22820,28903,0,30115,43920,Computer Science and Engineering,2018
KNR,"Govt. College of Engineering, Kannur.",G,3654,0,5050,3945,4788,9229,5780,3671,0,0,0,28444,19023,Computer Science and Engineering,2018
KTE,"Govt. Rajiv Gandhi Institute of Tech., Kottayam.",G,1627,0,1844,2920,2672,2087,11485,2648,8040,16781,17248,22880,16264,Computer Science and Engineering,2018
MAC,"M A College of Engineering, Kothamangalam.",G,1458,0,2301,2820,2347,3362,0,2523,0,0,0,23616,42935,Computer Science and Engineering,2018
NSS,"N S S College of Engineering, Palakkad.",G,2009,0,2990,2981,2402,4853,12870,3858,9053,16904,32468,25135,44407,Computer Science and Engineering,2018
PKD,"Govt. Engineering College, Sreekrishnapuram.",G,3915,0,7331,7463,5845,15781,19302,7724,0,0,0,32515,42754,Computer Science and Engineering,2018
TCR,"Govt. Engineering College,Thrissur.",G,678,0,877,820,1080,1332,3386,1257,7468,14204,22869,10395,42516,Computer Science and Engineering,2018
TKM,"T K M College of Engineering, Kollam.",G,468,0,573,706,610,3672,4137,1218,0,0,0,11867,8885,Computer Science and Engineering,2018
TVE,"College of Engineering,Thiruvananthapuram.",G,103,0,158,216,182,197,117,1027,371,2167,6092,4105,2961,Computer Science and Engineering,2018
WYD,"Govt. Engineering College, Mananthavady.",G,3564,0,9471,9401,10901,22915,34956,11999,0,38280,0,34950,41731,Computer Science and Engineering,2018
ADR,"College of Engineering, Adoor",N,10741,35384,13843,17821,15423,19702,0,0,20082,0,0,38225,0,Computer Science and Engineering,2018
AEC,"College of Engineering, Aranmula, Pathanamthitta.",N,26450,46525,27352,29184,33724,37992,42459,30348,0,0,0,45133,0,Computer Science and Engineering,2018
CEA,"College of Engineering, Attingal, Thiruvananthapuram.",N,15208,37622,19978,17397,17448,32068,35255,0,0,0,0,40808,0,Computer Science and Engineering,2018
CEC,"College of Engineering, Cherthala, Alappuzha.",N,20060,46372,23857,23515,26320,21540,0,23398,45091,40075,0,42727,0,Computer Science and Engineering,2018
CEK,"College of Engineering, Kottarakkara, Kollam.",N,23995,46677,27916,28115,24792,24889,37569,25154,39744,30380,0,42989,0,Computer Science and Engineering,2018
CEM,"College of Engineering, Muttathara.",N,28898,44352,29489,32516,36211,34256,0,0,0,0,0,43077,0,Computer Science and Engineering,2018
CHN,"College of Engineering, Chengannur, Alappuzha.",N,7285,22267,13148,12058,12873,31634,31985,11728,0,34331,33110,41675,44599,Computer Science and Engineering,2018
KGR,"College of Engineering, Kidangoor.",N,18867,44776,23342,28395,28831,39763,0,22280,0,0,0,45542,0,Computer Science and Engineering,2018
KNP,"College of Engineering, Karunagappally.",N,23913,45987,25653,29196,26925,38816,0,0,0,0,0,45580,0,Computer Science and Engineering,2018
KSD,"LBS College of Engineering, Kasaragod.",N,16732,46099,19762,18564,18599,45082,0,28081,0,0,0,46605,44495,Computer Science and Engineering,2018
LBT,"LBS Institute of Tech. for Women, Poojapura, TVPM",N,10893,32793,15328,15720,13347,18501,39588,15141,12284,31313,0,45723,0,Computer Science and Engineering,2018
MDL,"Model Engineering College, Thrikkakkara.",N,1144,3352,1878,2606,1804,1793,8199,1808,5725,0,0,24996,0,Computer Science and Engineering,2018
MNR,"College of Engineering, Munnar.",N,22197,45533,26788,24457,26719,24989,38958,0,0,0,0,40406,0,Computer Science and Engineering,2018
PEC,"College of Engineering, Pathanapuram.",N,23330,45111,26596,24686,0,0,46012,24971,44383,0,0,43643,0,Computer Science and Engineering,2018
PJR,"College of Engineering, Poonjar.",N,28056,44618,29484,32603,36455,44089,0,33385,0,0,0,45260,0,Computer Science and Engineering,2018
PRN,College of Engineering Perumon.,N,16205,38892,18458,22610,23397,23177,0,0,0,0,0,46498,0,Computer Science and Engineering,2018
PRP,"College of Engineering & Management, Punnapra.",N,21290,40320,22957,25613,22816,35757,0,25455,0,0,0,43368,45742,Computer Science and Engineering,2018
PTA,"College of Engineering, Kallooppara.",N,20450,43733,22390,26682,36452,39905,0,23541,36115,0,0,46269,0,Computer Science and Engineering,2018
SCT,"S C T College of Engineering, Pappanamcode.",N,3586,8722,5138,7611,4022,14630,0,0,0,0,33390,41375,0,Computer Science and Engineering,2018
TKR,"College of Engineering, Thrikarippur, Kasaragod.",N,17612,43734,18229,20809,17782,30550,26398,34095,0,0,38668,43239,0,Computer Science and Engineering,2018
TLY,"College of Engineering, Thalassery, Kannur.",N,11975,28920,14567,13473,12113,32349,21067,14545,0,0,0,41544,0,Computer Science and Engineering,2018
UCE,"University College of Engineering,Thodupuzha.",N,26966,0,30821,30379,34303,35602,0,27035,36878,37260,0,46045,45364,Computer Science and Engineering,2018
UCK,"University College of Engineering, Kariavattom.",N,14621,35695,17192,16286,16344,23767,32220,18882,0,0,0,41652,0,Computer Science and Engineering,2018
VDA,"College of Engineering, Vadakara, Kozhikode.",N,14268,32298,15668,15477,15658,26350,0,0,0,0,0,42987,0,Computer Science and Engineering,2018
AAE,"AlAzhar College of Engineering & Technology, Thodupuzha.",S,45603,0,0,0,0,0,0,0,0,0,0,0,0,Computer Science and Engineering,2018
AIK,"Albertian Institute of Science and Technology, Kalamassery.",S,30183,0,42577,34832,0,30504,0,0,0,0,0,38830,0,Computer Science and Engineering,2018
AJC,"Amal Jyothi College of Engineering, Koovapally P O, Kanjirapally.",S,18178,0,29522,31451,22179,24799,40960,34602,38339,0,0,40297,0,Computer Science and Engineering,2018
AME,"Ammini College of Engineering, Mankara, Palakkad.",S,45797,0,0,0,0,0,0,0,0,0,0,0,0,Computer Science and Engineering,2018
ASI,"Adi Sankara Institute of Engg. & Tech., Kalady, Ernakulam.",S,17783,0,24275,23023,26306,24416,31626,19528,0,30376,0,46635,0,Computer Science and Engineering,2018
ATP,"Ahalia School of Engineering & Technology, Pudussery, Palakkad.",S,35723,0,40190,0,0,0,0,45740,0,0,0,0,0,Computer Science and Engineering,2018
AWH,"AWH Engineering College, Kozhikkode",S,32704,0,41020,33732,0,0,0,0,0,0,0,46374,0,Computer Science and Engineering,2018
AXE,"Axis College of Engineering & Technology, Murikkingal, Thrissur.",S,44638,0,0,0,0,0,0,0,0,0,0,0,0,Computer Science and Engineering,2018
BMC,"Baselios Mathew II College of Engg., Sasthamcotta, Kollam.",S,40613,0,43493,46314,41616,44792,44249,0,0,0,0,0,0,Computer Science and Engineering,2018
BTE,"Baselios Thomas I Catholicose College of Engg. &Tech., Koothattukulam.",S,46202,0,0,0,0,0,0,0,0,0,0,0,0,Computer Science and Engineering,2018
CCE,"Christ College of Engineering, Irinjalakuda.",S,18258,0,23754,41230,0,0,31762,0,0,0,0,45188,0,Computer Science and Engineering,2018
CCV,"Cochin College of Engg.  and Technology, Valanchery, Malappuram.",S,46630,0,0,0,0,0,0,0,0,0,0,0,0,Computer Science and Engineering,2018
CIM,"Cochin Institute of Science and Technology, Muvattupuzha.",S,45558,0,0,0,0,0,0,0,0,0,0,0,0,Computer Science and Engineering,2018
CKC,"Christ Knowledge City for Women, Kuzhoor,EKM",S,0,0,0,0,0,0,0,0,0,0,0,0,0,Computer Science and Engineering,2018
CMA,"Carmel College of Engg. & Technology, Punnapra, Alappuzha.",S,46267,0,0,0,0,0,0,0,0,0,0,0,0,Computer Science and Engineering,2018
DMC,"M Dasan Memmorial Coop. Inst. of Engg. & Inf. Tech., Koyilandy.",S,44759,0,0,0,0,0,0,0,0,0,0,0,0,Computer Science and Engineering,2018
ECE,"Sree Ernakulathappan College of Engg. & Mgmnt., Mukundapuram.",S,0,0,0,0,0,0,0,0,0,0,0,0,0,Computer Science and Engineering,2018
EKC,"Eranad Knowledgecity Technical Campus, Cherukulam, ManjerI",S,45309,0,0,45490,0,0,0,0,0,0,0,0,0,Computer Science and Engineering,2018
FIT,"Federal Institute of Science & Tech., Angamaly.",S,9055,0,11909,13143,10471,16730,32824,17310,37216,0,0,45432,0,Computer Science and Engineering,2018
FOP,"Focus Institute of Science and Technology, Poomala, Thrissur.",S,43723,0,0,0,0,0,0,0,0,0,0,0,0,Computer Science and Engineering,2018
GIT,"Gurudeva Institute of Science & Technology, Puthuppally.",S,43985,0,0,0,0,0,0,0,0,0,0,0,0,Computer Science and Engineering,2018
GWE,"K R Gouri Amma College of Engineering, Thuravoor, Cherthala.",S,46240,0,0,0,0,0,0,0,0,0,0,0,0,Computer Science and Engineering,2018
HCE,"Heera College of Engineering & Technology, Nedumangad.",S,46399,0,0,0,0,0,0,0,0,0,0,0,0,Computer Science and Engineering,2018
HGW,"Holy Grace Academy of Engineering, Mala, Thrissur.",S,46659,0,0,0,0,0,0,0,0,0,0,0,0,Computer Science and Engineering,2018
HKE,"Hindustan College of Engineering, Kulathupuzha.",S,34440,0,37445,38866,0,0,0,0,0,0,0,0,0,Computer Science and Engineering,2018
ICE,"Ilahia College of Engineering & Tech., Moovattupuzha.",S,42023,0,42631,44141,0,0,0,0,0,0,0,0,0,Computer Science and Engineering,2018
ICT,"Ilahia School of Science & Technology, Muvattupuzha.",S,46486,0,0,0,0,0,0,0,0,0,0,0,0,Computer Science and Engineering,2018
IES,"I E S College of Engineering, Chittilappilly.",S,42202,0,45570,42515,0,0,0,0,0,0,0,0,0,Computer Science and Engineering,2018
IGW,"Indira Gandhi Inst. of Engineering & Tech., Kothamangalam",S,39453,0,45129,44356,0,0,0,0,0,0,0,0,0,Computer Science and Engineering,2018
ILE,"ILM College of Engineering, Perumbavoor, Ernakulam.",S,45750,0,0,0,0,0,0,0,0,0,0,0,0,Computer Science and Engineering,2018
JBT,"Jai Bharath College of Management & Engg. Tech., Perumbavoor.",S,44704,0,0,0,0,0,0,0,0,0,0,0,0,Computer Science and Engineering,2018
JCE,"Jawaharlal College of Engineering & Technology, Ottappalam.",S,46619,0,0,0,0,0,0,0,0,0,0,46683,0,Computer Science and Engineering,2018
JEC,"Jyothi Engineering College, Cheruthuruthy.",S,30260,0,35140,43025,35858,0,0,41753,0,0,0,45790,0,Computer Science and Engineering,2018
JIT,"John Cox Memorial CSI Institute of Technology, Thiruvananthapuram.",S,45738,0,0,0,0,46302,0,0,0,0,0,0,0,Computer Science and Engineering,2018
KIT,"Kottayam Institute of Tech. & Science, Pallicathode, Kottayam.",S,44468,0,0,0,0,0,0,0,0,0,0,0,0,Computer Science and Engineering,2018
KMC,"KMCT College of  Engineering, Kozhikkode.",S,43355,0,43429,43844,0,0,0,0,0,0,0,0,0,Computer Science and Engineering,2018
KME,"K M E A Engineering College, Edathala.",S,33374,0,39107,36577,35480,39910,0,0,0,0,0,0,0,Computer Science and Engineering,2018
KMW,"KMCT College of  Engineering for Women, Manassery.",S,43898,0,0,0,0,0,0,0,0,0,0,0,0,Computer Science and Engineering,2018
LMC,"Lourdes Matha College of Science and Technology, Kuttichal.",S,46138,0,0,0,0,0,0,0,0,0,0,0,0,Computer Science and Engineering,2018
MBC,"Mar Baselios Christian College of Engg. & Tech., Peermede.",S,35978,0,0,40269,37947,0,0,0,0,0,0,44176,0,Computer Science and Engineering,2018
MBI,"Mar Baselios Institute of Technology & Science, Kothamangalam.",S,23731,0,36845,28814,41304,36803,0,0,0,0,0,36079,0,Computer Science and Engineering,2018
MBT,"Mar Baselious College of Engg. & Tech., Thiruvananthapuram.",S,13083,0,26688,20378,14987,30999,43519,29161,24783,0,0,44041,0,Computer Science and Engineering,2018
MCE,"Marian Engineering College, Kazhakuttom.",S,27738,0,36425,38134,31035,29199,0,0,0,0,0,45785,0,Computer Science and Engineering,2018
MCK,"Musaliar College of Engineering & Tech., Pathanamthitta.",S,45304,0,0,0,0,0,0,0,0,0,0,0,0,Computer Science and Engineering,2018
MCT,"Mohandas College of Engg. & Tech., Nedumangad.",S,39028,0,44149,43902,0,0,0,0,0,0,0,44723,0,Computer Science and Engineering,2018
MEA,"M E A Engineering College, Malappuram.",S,28485,0,35843,28626,0,0,0,42043,0,0,0,0,0,Computer Science and Engineering,2018
MEC,"Malabar College of Engineering & Tech., Wadakancherry.",S,46100,0,0,0,0,0,0,0,0,0,0,0,0,Computer Science and Engineering,2018
MEE,"MES College of Engineering & Technology, .Ernakulam.",S,36216,0,39798,37789,0,42218,0,0,0,0,0,44802,0,Computer Science and Engineering,2018
MEK,"MES Institute of Tech. & Management, Chathannoor.",S,43897,0,46053,44542,0,0,0,0,0,0,0,0,0,Computer Science and Engineering,2018
MES,"M E S College of Engineering, Kuttippuram.",S,17097,0,24102,19014,23831,0,0,30753,0,0,0,44392,0,Computer Science and Engineering,2018
MET,"Met's School of Engineering, Mala.",S,45287,0,0,0,0,0,0,0,0,0,0,0,0,Computer Science and Engineering,2018
MGC,"M G College of Engineering, Thiruvallom.",S,45202,0,0,0,0,0,0,0,0,0,0,0,0,Computer Science and Engineering,2018
MGE,"MGM College of Engineering & Technology, Ernakulam",S,46686,0,0,0,0,0,0,0,0,0,0,0,0,Computer Science and Engineering,2018
MGP,"Saintgits College of Engineering, Kottayam",S,20852,0,31026,35273,34084,42970,39569,33249,0,0,0,0,45831,Computer Science and Engineering,2018
MLM,"Mangalam College of Engineering, Ettumanoor.",S,46489,0,0,0,0,0,0,0,0,0,0,0,0,Computer Science and Engineering,2018
MLT,"Malabar Institute of Technology, Anjarakandi.",S,46536,0,0,0,0,0,0,0,0,0,0,0,0,Computer Science and Engineering,2018
MTA,"Matha College of Technology, North Pravur.",S,45425,0,0,0,0,0,0,0,0,0,0,0,0,Computer Science and Engineering,2018
MUS,"Muslim Association College of Engineering, Venjaramoodu.",S,45550,0,0,0,0,0,0,0,0,0,0,0,0,Computer Science and Engineering,2018
MUT,"Muthoot Institute of Tech. & Science, Puthencurz, Ernakulam.",S,10522,0,14032,15612,16271,10836,0,0,0,0,0,0,0,Computer Science and Engineering,2018
MZC,"Mount Zion College of Engg., Pathanamthitta.",S,45805,0,0,0,0,0,0,0,0,0,0,0,0,Computer Science and Engineering,2018
MZW,"Mount Zion Institute of Science & Tehnology, Chengannur",S,46636,0,0,0,0,0,0,0,0,0,0,0,0,Computer Science and Engineering,2018
NCE,"Nehru College of Engg. & Research Centre, Thiruvillwamala.",S,46430,0,0,0,0,0,0,0,0,0,0,0,0,Computer Science and Engineering,2018
NIE,"Nirmala College of Engineering, Chalakudy.",S,46476,0,0,0,0,0,0,0,0,0,0,0,0,Computer Science and Engineering,2018
NML,"North Malabar Institute of Technology, Kanhangad.",S,41227,0,0,0,0,0,0,0,0,0,0,0,0,Computer Science and Engineering,2018
PRC,"Providence College of Engineering, Chengannur.",S,38647,0,43078,41231,0,0,0,0,0,0,0,0,0,Computer Science and Engineering,2018
PRS,"PRS College of Engineering & Tech., Neyyattinkara.",S,44269,0,0,0,0,0,0,0,0,0,0,0,0,Computer Science and Engineering,2018
RCE,"Royal College of Engineering & Technology, Thrissur.",S,46581,0,0,0,0,0,0,0,0,0,0,0,0,Computer Science and Engineering,2018
RET,"Rajagiri School of Engineering and Technology, Kochi.",S,5528,0,10614,10389,10535,9656,26556,8365,0,20927,32374,29813,46649,Computer Science and Engineering,2018
RIE,"Rajadhani Institute of Engineering & Tech., Attingal.",S,40627,0,46278,45561,0,0,0,45961,0,0,0,0,0,Computer Science and Engineering,2018
SBC,"Sree Buddha College of Engineering, Nooranadu.",S,35154,0,36236,45932,40011,0,0,45748,0,0,0,0,0,Computer Science and Engineering,2018
SBW,"Sree Buddha College of Engineering, Ayathil",S,46213,0,0,0,0,0,0,0,0,0,0,0,0,Computer Science and Engineering,2018
SCM,"SCMS School of Engg. & Tech., Ernakulam",S,14068,0,18040,21035,18868,19758,29538,20745,0,0,0,0,0,Computer Science and Engineering,2018
SGT,"Sadguru Swamy Nithyananda Insti. of Tech., Karsaragod",S,39718,0,0,0,0,0,0,0,0,0,0,0,0,Computer Science and Engineering,2018
SHR,"Sahrdaya College of Engineering and Technology, Kodakara.",S,28629,0,32939,43425,41426,36363,33230,36073,0,0,0,39724,0,Computer Science and Engineering,2018
